How much did you enjoy Foxglove?,How easy is it to use Foxglove?,What did you find difficult? What could be done to make using Foxglove easier?,How good does the UI look?,How easy do you think game modding is?,How extensible are games through modding?,What did you find difficult about modding? What did you find unclear?,How likely are you to use Foxglove to manage LÖVE games?,How likely are you to use Foxglove to manage LÖVE mods?,"If you had full control over Foxglove and could make me do whatever you want, what would you add or change?",Any thoughts not covered by the previous questions go here.
3,3,No idea.,2,1,1,Computer.,3,3,I don't know.,
3,2,Im not sure,4,5,3,Not sure,1,1,No real changes. Perhaps just art? as a launcher itself it seems servicable,None thank you
3,4,"Honestly, from what I’ve seen, I can’t really think of anything that could really be improved I think it’s fine and dandy the way it is! ",5,3,5,Coding ,2,4,"Could use more smiley faces to improve user happiness, and encourage positive emotions!","I wish I had more to add here, but I think I’ve said my peace! "
4,4,From the demo it seems like you need to close the app and reopen it for new games to show up. Maybe add a refresh button so you don't have to do that.,5,5,4,I imagine this wouldn't work for games that require specific mod loaders? Maybe it does work though so I don't know.,3,3,Add navigation with the mouse maybe?,Good job! I think having a launcher like this for easily launching and modding all sorts of games is something I would genuinely use.
3,3,Not sure how it is installed but it seems like you simply drag a game into it and you can play the game through it. looks easy enough !,5,3,3,"I really know nothing at all about modding, as far as I understand it is a way to change a game to your liking illegally (?) ",3,3,"Nothing would change, UI looks very nice and it seems easy to use ! Maybe a little info about what it is preceding this survey would be helpful",I like how the ratchelor is on the list of games u have 
